{
  "contractVersion": "1.0",
  "mode": "full",
  "reviewers": [
    "code-quality",
    "security",
    "performance"
  ],
  "budgets": {
    "maxFiles": 50,
    "maxChangedLines": 6000,
    "maxLinesPerFile": 2000,
    "maxBytesPerFile": 1048576,
    "maxInputTokensPerReviewer": 190000,
    "maxOutputTokensPerReviewer": 2000,
    "maxModelCalls": 3,
    "timeoutSeconds": 120
  },
  "dataPolicy": {
    "mode": "approved-hosted",
    "selectedProvider": "anthropic-claude-code",
    "allowedProviders": [
      "anthropic-claude-code"
    ]
  },
  "pathPolicy": {
    "excludedPathGlobs": [
      ".gitignore",
      ".travis.yml",
      "CHANGELOG.md",
      "Cargo.toml",
      "HACKING.md",
      "LICENSE-APACHE",
      "LICENSE-MIT",
      "PERFORMANCE.md",
      "README.md",
      "appveyor.yml",
      "bench/**",
      "ci/**",
      "examples/**",
      "regex-capi/**",
      "regex-debug/**",
      "regex-syntax/**",
      "regex_macros/**",
      "scripts/**",
      "src/backtrack.rs",
      "src/compile.rs",
      "src/dfa.rs",
      "src/error.rs",
      "src/exec.rs",
      "src/expand.rs",
      "src/freqs.rs",
      "src/input.rs",
      "src/lib.rs",
      "src/literals.rs",
      "src/pattern.rs",
      "src/pikevm.rs",
      "src/prog.rs",
      "src/re_builder.rs",
      "src/re_plugin.rs",
      "src/re_set.rs",
      "src/re_trait.rs",
      "src/simd_accel/**",
      "src/simd_fallback/**",
      "src/sparse.rs",
      "src/testdata/**",
      "src/utf8.rs",
      "tests/**"
    ],
    "generatedPathGlobs": [
      "**/node_modules/**",
      "**/vendor/**",
      "**/dist/**",
      "**/build/**",
      "**/coverage/**"
    ],
    "symlinkHandling": "reject",
    "binaryHandling": "report-and-skip"
  },
  "secretPolicy": {
    "scannerRequired": true,
    "sensitivePathGlobs": [
      ".env",
      ".env.*",
      "**/.env",
      "**/.env.*",
      "**/.aws/**",
      "**/.ssh/**",
      "**/.config/gcloud/**",
      "**/credentials",
      "**/credentials.*",
      "**/*.pem",
      "**/*.key",
      "**/*.p12",
      "**/*.pfx"
    ],
    "onScannerFailure": "stop-review"
  },
  "sandbox": {
    "executionRequested": false,
    "backend": "none",
    "network": "disabled"
  }
}
