{
  "contractVersion": "1.0",
  "mode": "full",
  "reviewers": [
    "code-quality",
    "security",
    "performance"
  ],
  "budgets": {
    "maxFiles": 50,
    "maxChangedLines": 6000,
    "maxLinesPerFile": 2000,
    "maxBytesPerFile": 1048576,
    "maxInputTokensPerReviewer": 150000,
    "maxOutputTokensPerReviewer": 2000,
    "maxModelCalls": 3,
    "timeoutSeconds": 120
  },
  "dataPolicy": {
    "mode": "approved-hosted",
    "selectedProvider": "anthropic-claude-code",
    "allowedProviders": [
      "anthropic-claude-code"
    ]
  },
  "pathPolicy": {
    "excludedPathGlobs": [
      ".azure-pipelines.yml",
      ".circleci/**",
      ".cirrus.yml",
      ".dcignore",
      ".dir-locals.el",
      ".git-blame-ignore-revs",
      ".gitattributes",
      ".github/**",
      ".gitignore",
      ".mailmap",
      ".reuse/**",
      "CHANGES",
      "CMake/**",
      "CMakeLists.txt",
      "COPYING",
      "GIT-INFO",
      "LICENSES/**",
      "MacOSX-Framework",
      "Makefile.am",
      "Makefile.dist",
      "README",
      "README.md",
      "RELEASE-NOTES",
      "SECURITY.md",
      "acinclude.m4",
      "appveyor.yml",
      "buildconf",
      "buildconf.bat",
      "configure.ac",
      "curl-config.in",
      "docs/**",
      "include/**",
      "lib/.checksrc",
      "lib/.gitattributes",
      "lib/.gitignore",
      "lib/CMakeLists.txt",
      "lib/Makefile.am",
      "lib/Makefile.inc",
      "lib/Makefile.mk",
      "lib/Makefile.soname",
      "lib/altsvc.c",
      "lib/altsvc.h",
      "lib/amigaos.c",
      "lib/amigaos.h",
      "lib/arpa_telnet.h",
      "lib/asyn-ares.c",
      "lib/asyn-thread.c",
      "lib/asyn.h",
      "lib/base64.c",
      "lib/bufq.c",
      "lib/bufq.h",
      "lib/bufref.c",
      "lib/bufref.h",
      "lib/c-hyper.c",
      "lib/c-hyper.h",
      "lib/cf-h1-proxy.c",
      "lib/cf-h1-proxy.h",
      "lib/cf-h2-proxy.c",
      "lib/cf-h2-proxy.h",
      "lib/cf-haproxy.c",
      "lib/cf-haproxy.h",
      "lib/cf-https-connect.c",
      "lib/cf-https-connect.h",
      "lib/cf-socket.c",
      "lib/cf-socket.h",
      "lib/cfilters.c",
      "lib/cfilters.h",
      "lib/config-amigaos.h",
      "lib/config-dos.h",
      "lib/config-mac.h",
      "lib/config-os400.h",
      "lib/config-plan9.h",
      "lib/config-riscos.h",
      "lib/config-win32.h",
      "lib/config-win32ce.h",
      "lib/conncache.c",
      "lib/conncache.h",
      "lib/connect.c",
      "lib/connect.h",
      "lib/content_encoding.c",
      "lib/content_encoding.h",
      "lib/cookie.c",
      "lib/cookie.h",
      "lib/curl_addrinfo.c",
      "lib/curl_addrinfo.h",
      "lib/curl_base64.h",
      "lib/curl_config.h.cmake",
      "lib/curl_ctype.h",
      "lib/curl_des.c",
      "lib/curl_des.h",
      "lib/curl_endian.c",
      "lib/curl_endian.h",
      "lib/curl_fnmatch.c",
      "lib/curl_fnmatch.h",
      "lib/curl_get_line.c",
      "lib/curl_get_line.h",
      "lib/curl_gethostname.c",
      "lib/curl_gethostname.h",
      "lib/curl_gssapi.c",
      "lib/curl_gssapi.h",
      "lib/curl_hmac.h",
      "lib/curl_krb5.h",
      "lib/curl_ldap.h",
      "lib/curl_md4.h",
      "lib/curl_md5.h",
      "lib/curl_memory.h",
      "lib/curl_memrchr.c",
      "lib/curl_memrchr.h",
      "lib/curl_multibyte.c",
      "lib/curl_multibyte.h",
      "lib/curl_ntlm_core.c",
      "lib/curl_ntlm_core.h",
      "lib/curl_ntlm_wb.c",
      "lib/curl_ntlm_wb.h",
      "lib/curl_path.c",
      "lib/curl_path.h",
      "lib/curl_printf.h",
      "lib/curl_range.c",
      "lib/curl_range.h",
      "lib/curl_rtmp.c",
      "lib/curl_rtmp.h",
      "lib/curl_sasl.c",
      "lib/curl_sasl.h",
      "lib/curl_setup.h",
      "lib/curl_setup_once.h",
      "lib/curl_sha256.h",
      "lib/curl_sspi.c",
      "lib/curl_sspi.h",
      "lib/curl_threads.c",
      "lib/curl_threads.h",
      "lib/curl_trc.c",
      "lib/curl_trc.h",
      "lib/curlx.h",
      "lib/dict.c",
      "lib/dict.h",
      "lib/doh.c",
      "lib/doh.h",
      "lib/dynbuf.c",
      "lib/dynbuf.h",
      "lib/dynhds.c",
      "lib/dynhds.h",
      "lib/easy.c",
      "lib/easy_lock.h",
      "lib/easygetopt.c",
      "lib/easyif.h",
      "lib/easyoptions.c",
      "lib/easyoptions.h",
      "lib/escape.c",
      "lib/escape.h",
      "lib/file.c",
      "lib/file.h",
      "lib/fileinfo.c",
      "lib/fileinfo.h",
      "lib/fopen.c",
      "lib/fopen.h",
      "lib/formdata.c",
      "lib/formdata.h",
      "lib/ftp.c",
      "lib/ftp.h",
      "lib/ftplistparser.c",
      "lib/ftplistparser.h",
      "lib/functypes.h",
      "lib/getenv.c",
      "lib/getinfo.c",
      "lib/getinfo.h",
      "lib/gopher.c",
      "lib/gopher.h",
      "lib/hash.c",
      "lib/hash.h",
      "lib/headers.c",
      "lib/headers.h",
      "lib/hmac.c",
      "lib/hostasyn.c",
      "lib/hostip.c",
      "lib/hostip.h",
      "lib/hostip4.c",
      "lib/hostip6.c",
      "lib/hostsyn.c",
      "lib/hsts.c",
      "lib/hsts.h",
      "lib/http.c",
      "lib/http.h",
      "lib/http1.c",
      "lib/http1.h",
      "lib/http2.c",
      "lib/http2.h",
      "lib/http_aws_sigv4.c",
      "lib/http_aws_sigv4.h",
      "lib/http_chunks.c",
      "lib/http_chunks.h",
      "lib/http_digest.c",
      "lib/http_digest.h",
      "lib/http_negotiate.c",
      "lib/http_negotiate.h",
      "lib/http_ntlm.c",
      "lib/http_ntlm.h",
      "lib/http_proxy.c",
      "lib/http_proxy.h",
      "lib/idn.c",
      "lib/idn.h",
      "lib/if2ip.c",
      "lib/if2ip.h",
      "lib/imap.c",
      "lib/imap.h",
      "lib/inet_ntop.c",
      "lib/inet_ntop.h",
      "lib/inet_pton.c",
      "lib/inet_pton.h",
      "lib/krb5.c",
      "lib/ldap.c",
      "lib/libcurl.plist.in",
      "lib/libcurl.rc",
      "lib/libcurl.vers.in",
      "lib/llist.c",
      "lib/llist.h",
      "lib/macos.c",
      "lib/macos.h",
      "lib/md4.c",
      "lib/md5.c",
      "lib/memdebug.c",
      "lib/memdebug.h",
      "lib/mime.c",
      "lib/mime.h",
      "lib/mprintf.c",
      "lib/mqtt.c",
      "lib/mqtt.h",
      "lib/multi.c",
      "lib/multihandle.h",
      "lib/multiif.h",
      "lib/netrc.c",
      "lib/netrc.h",
      "lib/nonblock.c",
      "lib/nonblock.h",
      "lib/noproxy.c",
      "lib/noproxy.h",
      "lib/openldap.c",
      "lib/optiontable.pl",
      "lib/parsedate.c",
      "lib/parsedate.h",
      "lib/pingpong.c",
      "lib/pingpong.h",
      "lib/pop3.c",
      "lib/pop3.h",
      "lib/progress.c",
      "lib/progress.h",
      "lib/psl.c",
      "lib/psl.h",
      "lib/rand.c",
      "lib/rand.h",
      "lib/rename.c",
      "lib/rename.h",
      "lib/rtsp.c",
      "lib/rtsp.h",
      "lib/select.c",
      "lib/select.h",
      "lib/sendf.c",
      "lib/sendf.h",
      "lib/setopt.c",
      "lib/setopt.h",
      "lib/setup-os400.h",
      "lib/setup-vms.h",
      "lib/setup-win32.h",
      "lib/sha256.c",
      "lib/share.c",
      "lib/share.h",
      "lib/sigpipe.h",
      "lib/slist.c",
      "lib/slist.h",
      "lib/smb.c",
      "lib/smb.h",
      "lib/smtp.c",
      "lib/smtp.h",
      "lib/sockaddr.h",
      "lib/socketpair.c",
      "lib/socketpair.h",
      "lib/socks.h",
      "lib/socks_gssapi.c",
      "lib/socks_sspi.c",
      "lib/speedcheck.c",
      "lib/speedcheck.h",
      "lib/splay.c",
      "lib/splay.h",
      "lib/strcase.c",
      "lib/strcase.h",
      "lib/strdup.c",
      "lib/strdup.h",
      "lib/strerror.c",
      "lib/strerror.h",
      "lib/strtok.c",
      "lib/strtok.h",
      "lib/strtoofft.c",
      "lib/strtoofft.h",
      "lib/system_win32.c",
      "lib/system_win32.h",
      "lib/telnet.c",
      "lib/telnet.h",
      "lib/tftp.c",
      "lib/tftp.h",
      "lib/timediff.c",
      "lib/timediff.h",
      "lib/timeval.c",
      "lib/timeval.h",
      "lib/transfer.c",
      "lib/transfer.h",
      "lib/url.c",
      "lib/url.h",
      "lib/urlapi-int.h",
      "lib/urlapi.c",
      "lib/urldata.h",
      "lib/vauth/**",
      "lib/version.c",
      "lib/version_win32.c",
      "lib/version_win32.h",
      "lib/vquic/**",
      "lib/vssh/**",
      "lib/vtls/**",
      "lib/warnless.c",
      "lib/warnless.h",
      "lib/ws.c",
      "lib/ws.h",
      "libcurl.def",
      "libcurl.pc.in",
      "m4/**",
      "maketgz",
      "packages/**",
      "plan9/**",
      "projects/**",
      "scripts/**",
      "src/**",
      "tests/**",
      "winbuild/**"
    ],
    "generatedPathGlobs": [
      "**/node_modules/**",
      "**/vendor/**",
      "**/dist/**",
      "**/build/**",
      "**/coverage/**"
    ],
    "symlinkHandling": "reject",
    "binaryHandling": "report-and-skip"
  },
  "secretPolicy": {
    "scannerRequired": true,
    "sensitivePathGlobs": [
      ".env",
      ".env.*",
      "**/.env",
      "**/.env.*",
      "**/.aws/**",
      "**/.ssh/**",
      "**/.config/gcloud/**",
      "**/credentials",
      "**/credentials.*",
      "**/*.pem",
      "**/*.key",
      "**/*.p12",
      "**/*.pfx"
    ],
    "onScannerFailure": "stop-review"
  },
  "sandbox": {
    "executionRequested": false,
    "backend": "none",
    "network": "disabled"
  }
}
