{
  "contractVersion": "1.0",
  "mode": "full",
  "reviewers": [
    "code-quality",
    "security",
    "performance"
  ],
  "budgets": {
    "maxFiles": 50,
    "maxChangedLines": 6000,
    "maxLinesPerFile": 2000,
    "maxBytesPerFile": 1048576,
    "maxInputTokensPerReviewer": 100000,
    "maxOutputTokensPerReviewer": 2000,
    "maxModelCalls": 3,
    "timeoutSeconds": 120
  },
  "dataPolicy": {
    "mode": "approved-hosted",
    "selectedProvider": "anthropic-claude-code",
    "allowedProviders": [
      "anthropic-claude-code"
    ]
  },
  "pathPolicy": {
    "excludedPathGlobs": [
      ".gitattributes",
      ".github/**",
      ".gitignore",
      ".mvn/**",
      ".travis.yml",
      "LICENSE",
      "README.md",
      "SECURITY.md",
      "attic/**",
      "create-test-report.sh",
      "docs/**",
      "lgtm.yml",
      "mvnw",
      "mvnw.cmd",
      "pom.xml",
      "profile.sh",
      "release-notes/**",
      "run.sh",
      "src/main/java/com/fasterxml/jackson/databind/AbstractTypeResolver.java",
      "src/main/java/com/fasterxml/jackson/databind/AnnotationIntrospector.java",
      "src/main/java/com/fasterxml/jackson/databind/BeanDescription.java",
      "src/main/java/com/fasterxml/jackson/databind/BeanProperty.java",
      "src/main/java/com/fasterxml/jackson/databind/DatabindContext.java",
      "src/main/java/com/fasterxml/jackson/databind/DatabindException.java",
      "src/main/java/com/fasterxml/jackson/databind/DeserializationConfig.java",
      "src/main/java/com/fasterxml/jackson/databind/DeserializationContext.java",
      "src/main/java/com/fasterxml/jackson/databind/DeserializationFeature.java",
      "src/main/java/com/fasterxml/jackson/databind/InjectableValues.java",
      "src/main/java/com/fasterxml/jackson/databind/JavaType.java",
      "src/main/java/com/fasterxml/jackson/databind/JsonDeserializer.java",
      "src/main/java/com/fasterxml/jackson/databind/JsonMappingException.java",
      "src/main/java/com/fasterxml/jackson/databind/JsonNode.java",
      "src/main/java/com/fasterxml/jackson/databind/JsonSerializable.java",
      "src/main/java/com/fasterxml/jackson/databind/JsonSerializer.java",
      "src/main/java/com/fasterxml/jackson/databind/KeyDeserializer.java",
      "src/main/java/com/fasterxml/jackson/databind/MapperFeature.java",
      "src/main/java/com/fasterxml/jackson/databind/MappingIterator.java",
      "src/main/java/com/fasterxml/jackson/databind/MappingJsonFactory.java",
      "src/main/java/com/fasterxml/jackson/databind/Module.java",
      "src/main/java/com/fasterxml/jackson/databind/ObjectMapper.java",
      "src/main/java/com/fasterxml/jackson/databind/ObjectReader.java",
      "src/main/java/com/fasterxml/jackson/databind/ObjectWriter.java",
      "src/main/java/com/fasterxml/jackson/databind/PropertyMetadata.java",
      "src/main/java/com/fasterxml/jackson/databind/PropertyName.java",
      "src/main/java/com/fasterxml/jackson/databind/PropertyNamingStrategies.java",
      "src/main/java/com/fasterxml/jackson/databind/PropertyNamingStrategy.java",
      "src/main/java/com/fasterxml/jackson/databind/RuntimeJsonMappingException.java",
      "src/main/java/com/fasterxml/jackson/databind/SequenceWriter.java",
      "src/main/java/com/fasterxml/jackson/databind/SerializationConfig.java",
      "src/main/java/com/fasterxml/jackson/databind/SerializationFeature.java",
      "src/main/java/com/fasterxml/jackson/databind/SerializerProvider.java",
      "src/main/java/com/fasterxml/jackson/databind/annotation/**",
      "src/main/java/com/fasterxml/jackson/databind/cfg/**",
      "src/main/java/com/fasterxml/jackson/databind/deser/**",
      "src/main/java/com/fasterxml/jackson/databind/exc/**",
      "src/main/java/com/fasterxml/jackson/databind/ext/**",
      "src/main/java/com/fasterxml/jackson/databind/introspect/**",
      "src/main/java/com/fasterxml/jackson/databind/jdk14/**",
      "src/main/java/com/fasterxml/jackson/databind/json/**",
      "src/main/java/com/fasterxml/jackson/databind/jsonFormatVisitors/**",
      "src/main/java/com/fasterxml/jackson/databind/jsonschema/**",
      "src/main/java/com/fasterxml/jackson/databind/jsontype/**",
      "src/main/java/com/fasterxml/jackson/databind/module/**",
      "src/main/java/com/fasterxml/jackson/databind/node/ArrayNode.java",
      "src/main/java/com/fasterxml/jackson/databind/node/BaseJsonNode.java",
      "src/main/java/com/fasterxml/jackson/databind/node/BigIntegerNode.java",
      "src/main/java/com/fasterxml/jackson/databind/node/BinaryNode.java",
      "src/main/java/com/fasterxml/jackson/databind/node/BooleanNode.java",
      "src/main/java/com/fasterxml/jackson/databind/node/ContainerNode.java",
      "src/main/java/com/fasterxml/jackson/databind/node/DecimalNode.java",
      "src/main/java/com/fasterxml/jackson/databind/node/DoubleNode.java",
      "src/main/java/com/fasterxml/jackson/databind/node/FloatNode.java",
      "src/main/java/com/fasterxml/jackson/databind/node/IntNode.java",
      "src/main/java/com/fasterxml/jackson/databind/node/JsonNodeCreator.java",
      "src/main/java/com/fasterxml/jackson/databind/node/JsonNodeFactory.java",
      "src/main/java/com/fasterxml/jackson/databind/node/JsonNodeType.java",
      "src/main/java/com/fasterxml/jackson/databind/node/LongNode.java",
      "src/main/java/com/fasterxml/jackson/databind/node/MissingNode.java",
      "src/main/java/com/fasterxml/jackson/databind/node/NodeCursor.java",
      "src/main/java/com/fasterxml/jackson/databind/node/NodeSerialization.java",
      "src/main/java/com/fasterxml/jackson/databind/node/NullNode.java",
      "src/main/java/com/fasterxml/jackson/databind/node/NumericNode.java",
      "src/main/java/com/fasterxml/jackson/databind/node/ObjectNode.java",
      "src/main/java/com/fasterxml/jackson/databind/node/POJONode.java",
      "src/main/java/com/fasterxml/jackson/databind/node/ShortNode.java",
      "src/main/java/com/fasterxml/jackson/databind/node/TextNode.java",
      "src/main/java/com/fasterxml/jackson/databind/node/TreeTraversingParser.java",
      "src/main/java/com/fasterxml/jackson/databind/node/ValueNode.java",
      "src/main/java/com/fasterxml/jackson/databind/node/package-info.java",
      "src/main/java/com/fasterxml/jackson/databind/package-info.java",
      "src/main/java/com/fasterxml/jackson/databind/ser/**",
      "src/main/java/com/fasterxml/jackson/databind/type/**",
      "src/main/java/com/fasterxml/jackson/databind/util/**",
      "src/main/resources/**",
      "src/moditect/**",
      "src/test-jdk14/**",
      "src/test-jdk17/**",
      "src/test/**"
    ],
    "generatedPathGlobs": [
      "**/node_modules/**",
      "**/vendor/**",
      "**/dist/**",
      "**/build/**",
      "**/coverage/**"
    ],
    "symlinkHandling": "reject",
    "binaryHandling": "report-and-skip"
  },
  "secretPolicy": {
    "scannerRequired": true,
    "sensitivePathGlobs": [
      ".env",
      ".env.*",
      "**/.env",
      "**/.env.*",
      "**/.aws/**",
      "**/.ssh/**",
      "**/.config/gcloud/**",
      "**/credentials",
      "**/credentials.*",
      "**/*.pem",
      "**/*.key",
      "**/*.p12",
      "**/*.pfx"
    ],
    "onScannerFailure": "stop-review"
  },
  "sandbox": {
    "executionRequested": false,
    "backend": "none",
    "network": "disabled"
  }
}
